<?xml version="1.0" encoding="UTF-8"?>
<tns:config xmlns:tns="http://www.dabi.com/habitv/config/entities"
	xmlns:xsi="http://www.w3.org/2001/XMLSchema-instance"
	xsi:schemaLocation="http://www.dabi.com/habitv/config/entities config.xsd ">
	<demonTime>1800</demonTime>
	<workingDir>pub</workingDir>
	<indexDir>index</indexDir>
	<providerPluginDir>provider</providerPluginDir>
	<downloaderPluginDir>downloader</downloaderPluginDir>
	<exporterPluginDir>exporter</exporterPluginDir>
	<downloadOuput>downloads/#TVSHOW_NAME#-#EPISODE_NAME_CUT#.#EXTENSION#</downloadOuput>
	<downloader>
		<name>http</name>
	</downloader>
	<downloader>
		<name>rtmpdump</name>
		<binPath>bin\rtmpdump.exe</binPath>
	</downloader>
	<downloader>
		<name>aria2</name>
		<binPath>bin\aria2c.exe</binPath>
	</downloader>
	<downloader>
		<name>curl</name>
		<binPath>bin\curl.exe</binPath>
	</downloader>
	<taskDefinition>
		<taskName>category</taskName>
		<size>5</size>
	</taskDefinition>
	<taskDefinition>
		<taskName>export</taskName>
		<size>2</size>
	</taskDefinition>
	<taskDefinition>
		<taskName>retreive</taskName>
		<size>50</size>
	</taskDefinition>
	<taskDefinition>
		<taskName>search</taskName>
		<size>5</size>
	</taskDefinition>
	<taskDefinition>
		<taskName>download</taskName>
		<size>2</size>
	</taskDefinition>
	<taskDefinition>
		<taskName>curl</taskName>
		<size>2</size>		
	</taskDefinition>
	<taskDefinition>
		<taskName>ffmpeg</taskName>
		<size>1</size>
	</taskDefinition>	
</tns:config>
