<?xml version="1.0" encoding="UTF-8"?>
<tns:config xmlns:tns="http://www.dabi.com/habitv/config/entities"
	xmlns:xsi="http://www.w3.org/2001/XMLSchema-instance"
	xsi:schemaLocation="http://www.dabi.com/habitv/config/entities config.xsd ">
	<proxy>
		<protocol>HTTP</protocol>
		<host>127.0.0.1</host>
		<port>6588</port>
	</proxy>
	<proxy>
		<protocol>SOCKS</protocol>
		<host>127.0.0.1</host>
		<port>1080</port>
	</proxy>	
	<maxAttempts>1</maxAttempts>
	<demonTime>1800</demonTime>
	<fileNameCutSize>50</fileNameCutSize>
	<workingDir>../builder/pub</workingDir>
	<indexDir>../builder/pub/index</indexDir>
	<providerPluginDir>../builder/pub/provider</providerPluginDir>
	<downloaderPluginDir>../builder/pub/downloader</downloaderPluginDir>
	<exporterPluginDir>../builder/pub/exporter</exporterPluginDir>
	<downloadOuput>../builder/pub/downloads/#TVSHOW_NAME#-#EPISODE_NAME_CUT#.#EXTENSION#</downloadOuput>
	<downloader>
		<name>http</name>
	</downloader>
	<downloader>
		<name>rtmpdump</name>
		<binPath>..\rtmpDumpDownloader\exe\rtmpdump.exe</binPath>
	</downloader>
	<downloader>
		<name>aria2</name>
		<binPath>..\aria2Downloader\exe\aria2c.exe</binPath>
	</downloader>
	<downloader>
		<name>curl</name>
		<binPath>..\curlDownloader\exe\curl.exe</binPath>
	</downloader>
	<downloader>
		<name>ffmpeg</name>
		<binPath>..\ffmpegExporter\exe\ffmpeg.exe</binPath>
	</downloader>
	<downloader>
		<name>youtube</name>
		<binPath>..\youtubeDownloader\exe\youtube-dl.exe</binPath>
	</downloader>
	<exporter>
		<condition>
			<reference>#EXTENSION#</reference>
			<pattern>mp4|flv</pattern>
		</condition>
		<name>ffmpeg</name>
		<output>Re-encoding</output>
		<cmd>D:\script\video\gen\convertAviMp2Auto.bat "../builder/pub/downloads/#TVSHOW_NAME#-#EPISODE_NAME_CUT#.#EXTENSION#" "D:\divx\regular\#TVSHOW_NAME#-#EPISODE_NAME_CUT#.avi"</cmd>
	</exporter>
	<exporter>
		<condition>
			<reference>#EXTENSION#</reference>
			<pattern>mp4|flv</pattern>
		</condition>
		<name>move</name>
		<output>moving</output>
		<cmd>cmd /c move /Y D:\divx\regular\#TVSHOW_NAME#-#EPISODE_NAME_CUT#.avi D:\divx\regular\avi\</cmd>
	</exporter>
	<exporter>
		<condition>
			<reference>#EXTENSION#</reference>
			<pattern>mp4|flv</pattern>
		</condition>
		<name>curl</name>
		<output>Transferring to freebox</output>
		<cmd>..\curlDownloader\exe\curl.exe -T "D:/divx/regular/avi/#TVSHOW_NAME#-#EPISODE_NAME_CUT#.avi" "ftp://freebox:4688@hd1.freebox.fr/Disque dur/#TVSHOW_NAME#/#EPISODE_NAME_CUT#.avi" --ftp-create-dirs</cmd>
	</exporter>
	<exporter>
		<condition>
			<reference>#EXTENSION#</reference>
			<pattern>mp4|flv</pattern>
		</condition>
		<name>del</name>
		<output>Deleting</output>
		<cmd>cmd /c del ..\builder\pub\downloads\#TVSHOW_NAME#-#EPISODE_NAME_CUT#.#EXTENSION#</cmd>		
	</exporter>
	<exporter>
		<condition>
			<reference>#CHANNEL_NAME#</reference>
			<pattern>tvSubtitles</pattern>
		</condition>
		<name>mkv</name>
		<output>merge subtitle to video</output>
		<cmd>D:\script\closer\closer.bat "..\builder\pub\downloads\#TVSHOW_NAME#-#EPISODE_NAME_CUT#.#EXTENSION#" "D:\divx\regular\#TVSHOW_NAME#-#EPISODE_NAME_CUT#.mkv"</cmd>
	</exporter>
	<exporter>
		<condition>
			<reference>#CHANNEL_NAME#</reference>
			<pattern>tvSubtitles</pattern>
		</condition>
		<name>curl</name>
		<output>Transferring to freebox</output>
		<cmd>..\curlDownloader\exe\curl.exe -T "D:/divx/regular/#TVSHOW_NAME#-#EPISODE_NAME_CUT#.mkv" "ftp://freebox:4688@hd1.freebox.fr/Disque	dur/#TVSHOW_NAME#/#EPISODE_NAME_CUT#.avi" --ftp-create-dirs</cmd>
	</exporter>	
	<taskDefinition>
		<taskName>category</taskName>
		<size>5</size>
	</taskDefinition>
	<taskDefinition>
		<taskName>export</taskName>
		<size>2</size>
	</taskDefinition>
	<taskDefinition>
		<taskName>retreive</taskName>
		<size>50</size>
	</taskDefinition>
	<taskDefinition>
		<taskName>search</taskName>
		<size>5</size>
	</taskDefinition>
	<taskDefinition>
		<taskName>download</taskName>
		<size>2</size>
	</taskDefinition>
	<taskDefinition>
		<taskName>curl</taskName>
		<size>2</size>		
	</taskDefinition>
	<taskDefinition>
		<taskName>ffmpeg</taskName>
		<size>1</size>
	</taskDefinition>
</tns:config>
