<?xml version="1.0" encoding="UTF-8"?>
<tns:config xmlns:tns="http://www.dabi.com/habitv/config/entities"
	xmlns:xsi="http://www.w3.org/2001/XMLSchema-instance"
	xsi:schemaLocation="http://www.dabi.com/habitv/config/entities config.xsd ">
  <demonTime>1800</demonTime>
  <workingDir>.</workingDir>
  <indexDir>index</indexDir>
  <providerPluginDir>provider</providerPluginDir>
  <downloaderPluginDir>downloader</downloaderPluginDir>
  <exporterPluginDir>exporter</exporterPluginDir> 
  <downloadOuput>downloads/#TVSHOW_NAME#_#EPISODE_NAME_CUT#.#EXTENSION#</downloadOuput>
	<downloader>
		<name>http</name>
	</downloader>
	<downloader>
		<name>rtmpdump</name>
		<binPath>bin\rtmpdump.exe</binPath>
	</downloader>
	<downloader>
		<name>aria2</name>
		<binPath>bin\aria2c.exe</binPath>
	</downloader>
	<downloader>
		<name>curl</name>
		<binPath>bin\curl.exe</binPath>
	</downloader>
  	<!--<exporter>
		<condition>
			<reference>#EXTENSION#</reference>
			<pattern>mp4|flv</pattern>
		</condition>	
    	<name>mkdir</name>
    	<output>Create dir</output>
    	<cmd>cmd /c mkdir "D:\divx\regular\avi\#TVSHOW_NAME#" | echo createdir</cmd>
  	</exporter>	
	<exporter>
		<condition>
			<reference>#EXTENSION#</reference>
			<pattern>mp4|flv</pattern>
		</condition>
		<name>ffmpeg</name>
		<output>Re-encoding</output>
		<cmd>bin/ffmpeg.exe -y -i
			"D:\divx\regular\#TVSHOW_NAME#_#EPISODE_NAME_CUT#.#EXTENSION#" -vtag DIVX -f avi
			-vcodec mpeg4 -b 2600000 -acodec mp2 -ab 192000 -ar 48000 -ac 2
			"D:\divx\regular\avi\#TVSHOW_NAME#\#EPISODE_NAME_CUT#.avi"
		</cmd>
		<exporter>
			<condition>
				<reference>#EXTENSION#</reference>
				<pattern>mp4|flv</pattern>
			</condition>
			<name>ftp</name>
			<output>Transferring to freebox</output>
			<cmd>bin\curl.exe -T "D:\divx\regular\avi\#TVSHOW_NAME#\#EPISODE_NAME_CUT#.avi" "ftp://freebox:4688@hd1.freebox.fr/Disque dur/#TVSHOW_NAME#/" -REMOVEME-ftp-create-dirs</cmd>
		</exporter>
		<exporter>
			<condition>
				<reference>#EXTENSION#</reference>
				<pattern>mp4|flv</pattern>
			</condition>
			<name>del</name>
			<output>Deleting</output>
			<cmd>cmd /c del D:\divx\regular\#TVSHOW_NAME#_#EPISODE_NAME_CUT#.#EXTENSION#</cmd>
		</exporter>
	</exporter>
	-->
	<allDownloadTimeout>3600</allDownloadTimeout>
	<exportTimeout>3600</exportTimeout>
	<simultaneousTaskNumber>
		<taskName>export</taskName>
		<size>2</size>
	</simultaneousTaskNumber>
	<simultaneousTaskNumber>
		<taskName>export_main</taskName>
		<size>2</size>
	</simultaneousTaskNumber>
	<simultaneousTaskNumber>
		<taskName>search</taskName>
		<size>5</size>
	</simultaneousTaskNumber>
	<simultaneousTaskNumber>
		<taskName>download</taskName>
		<size>2</size>
	</simultaneousTaskNumber>
	<simultaneousTaskNumber>
		<taskName>curl</taskName>
		<size>2</size>
	</simultaneousTaskNumber>	
</tns:config>
